ID	ENGLISH	SPANISH	PORTUGUESE	NOTES	SIMPLIFIED	SEMANTIC FIELD	SENSORY CATEGORY
1399	head thrown back	cabeza echada para atrás		configurations in space		The body, Spatial relations	VISUAL
1400	scream	grito		"""human emissions"" (of sound)"		Speech and language	AUDITORY
1401	sneeze	estornudo		"""human emissions"" (of sound)"		The body	AUDITORY
1402	burp	eructo		"""human emissions"" (of sound)"		The body	AUDITORY
1403	hiccup	hipo		"""human emissions"" (of sound)"		The body	AUDITORY
1404	fart	pedo		"""human emissions"" (of sound)"		The body	AUDITORY
1405	snore	ronquido		"""human emissions"" (of sound)"		The body	AUDITORY
1406	whistle	silbido		"""human emissions"" (of sound)"		Basic actions and technology	AUDITORY
1407	whistle with hand	silbido con la mano		"""human emissions"" (of sound)"		Basic actions and technology	AUDITORY
1408	yawn	bostezo		"""human emissions"" (of sound)"		The body	AUDITORY
1409	breath	respiración		"""human emissions"" (of sound)"		The body	AUDITORY
1410	laugh	risa		"""human emissions"" (of sound)"		Emotion and values	AUDITORY
1411	giggle	risita		"""human emissions"" (of sound)"		Emotion and values	AUDITORY
1412	snort	resoplido (exhalación violenta)		"""human emissions"" (of sound)"		The body	AUDITORY
1413	spit	escupitajo		"""human emissions"" (of sound)"		The body	AUDITORY
1414	chattering teeth	dientes que castañean		"""human emissions"" (of sound)"		The body	AUDITORY
1415	sound of happiness	sonido de felicidad		"""human emissions"" (of sound)"		Emotion and values	AUDITORY
1416	sound of frog tsonpi	"sonido de rana ""tsonpi"""		Animal Emissions/movement		Animals	AUDITORY
1417	sound of bird sowi	"sonido de ave ""sowi"""		Animal Emissions/movement		Animals	AUDITORY
1418	sound of small frog kikika	"sonido de rana pequeña ""kikika"""		Animal Emissions/movement		Animals	AUDITORY
1419	sound of a beetle flying	sonido de escarabajo volando		Animal Emissions/movement		Animals	AUDITORY
1420	sound of hedgehog bobo	"sonido de erizo ""bobo"""		Animal Emissions/movement		Animals	AUDITORY
1421	yelp of dog	chillido de dolor de perro		Animal Emissions/movement		Animals	AUDITORY
1422	bark of small dog	ladrido de perro pequeño		Animal Emissions/movement		Animals	AUDITORY
1423	sound of bird corralera	"sonido de ave ""corralera"""		Animal Emissions/movement		Animals	AUDITORY
1424	sound of wild pigs para	"sonido de cerdo salvaje ""para"""		Animal Emissions/movement		Animals	AUDITORY
1425	sound of angry wild pig	sonido de cerdo salvaje enfurecido		Animal Emissions/movement		Animals	AUDITORY
1426	sound of wild turkey ele	"sonido de pavo salvaje ""ele"""		Animal Emissions/movement		Animals	AUDITORY
1427	movement of lightening bug	movimiento de luciérnaga		Animal Emissions/movement		Animals	VISUAL
1428	sound of small animal jumping from branch to branch	sonido de animal pequeño saltando de rama en rama		Animal Emissions/movement		Animals	AUDITORY
1429	sound of small animal rustling in leaves	sonido de animal pequeño moviéndose entre las hojas		Animal Emissions/movement		Animals	AUDITORY
1430	sound of baby chick	sonido de pollito		Animal Emissions/movement		Animals	AUDITORY
1431	animal speech	chillido de animal		Animal Emissions/movement		Animals	AUDITORY
1432	raise ears	elevar las orejas		Animal Emissions/movement		Animals	VISUAL
1433	centipede moving	ciempiés moviéndose		Animal Emissions/movement		Animals	VISUAL
1434	movement of hummingbird	movimiento de colibrí		Animal Emissions/movement		Animals	VISUAL
1435	sit with difficulty as does a very old, feeble person	sentarse con dificultad, como lo haría una persona anciana y débil		manner of movement		Motion	VISUAL
1436	small lump moving under the earth/as a small animal burrowing or a child moving under a blanket	pequeño bulto moviéndose bajo la tierra, como un animal pequeño que está cavando o un niño moviéndose debajo de una frazada		manner of movement		Motion	VISUAL
1437	slip on slippery surface	resbalarse en superficie resbaladiza		manner of movement		Motion	VISUAL
1438	swing as in a hammock	columpiarse, como en una hamaca		manner of movement		The house	VISUAL
1439	tremble as with chills	temblar, como cuando uno tiene escalofríos		manner of movement		Motion	VISUAL
1440	stumble or stagger	tropezar o tambalearse		manner of movement		Motion	VISUAL
1441	flip over	volcarse/dar la vuelta a algo		manner of movement		Motion	VISUAL
1442	flutter	batir alas		manner of movement		Animals	VISUAL, AUDITORY
1443	go/be on tiptoe	ir/estar de puntillas		manner of movement		Motion	VISUAL
1444	lick	lamer		manner of movement		The body	VISUAL, AUDITORY
1445	cross bamboo bridge	cruzar puente de bambú		manner of movement		Motion	VISUAL
1446	swirl as does a whirlpool	dar vueltas, como lo hace un remolino		manner of movement		Motion	VISUAL
1447	bob in water	mecerse en el agua		manner of movement		Motion	VISUAL
1448	sprout up as plant shoots	brotar, como los retoños de planta		manner of movement		Agriculture and vegetation	VISUAL
1449	jump	saltar		manner of movement		Basic actions and technology	VISUAL
1450	jingle small metal	tintinear metal pequeño		mixture of sound and overall gestalt		Basic actions and technology	AUDITORY
1451	hitting a tree with a hatchet	golpear un árbol con un hacha		mixture of sound and overall gestalt		Agriculture and vegetation	AUDITORY
1452	hitting something hard like a rock with a small light object such as a flower	golpear algo duro, como una roca, con un objeto pequeño y ligero, como una flor		mixture of sound and overall gestalt		Basic actions and technology	AUDITORY
1453	rub as two sticks together	frotar dos palos entre sí		mixture of sound and overall gestalt		Basic actions and technology	AUDITORY
1454	hitting something hard with a board	golpear algo duro con una tabla		mixture of sound and overall gestalt		Basic actions and technology	AUDITORY
1455	sound of a horse running, hard object hitting the ground	sonido de caballo corriendo, objeto duro golpeando el suelo		mixture of sound and overall gestalt		Animals	AUDITORY
1456	rocks falling	rocas cayendo		mixture of sound and overall gestalt		Motion	AUDITORY
1457	singing [sic, ¿singeing?] of fur or feathers	pelos o plumas ¿chamuscándose?		mixture of sound and overall gestalt		Basic actions and technology	?
1458	scraping with fingernails	raspar con las uñas		mixture of sound and overall gestalt		Basic actions and technology	AUDITORY
1459	small grain spilling out of sack	granos pequeños derramándose de un saco		mixture of sound and overall gestalt		Basic actions and technology	AUDITORY
1460	something big burning	algo grande quemándose		mixture of sound and overall gestalt		Basic actions and technology	AUDITORY
1461	sound of throwing dirt/wind	sonido de lanzar tierra / viento		mixture of sound and overall gestalt		The physical world	AUDITORY
1462	tree branches hitting the house	ramas de árbol golpeando la casa		mixture of sound and overall gestalt		Agriculture and vegetation	AUDITORY
1463	sound of floodwater	sonido de la crecida (de río, etc.)		mixture of sound and overall gestalt		The physical world	AUDITORY
1464	light wind in trees	viento ligero en los árboles		mixture of sound and overall gestalt		Agriculture and vegetation, The physical world	AUDITORY
1465	flat tire rolling/or something being flattened	neumáticos desinflados girando / o algo que está siendo ¿desinflado/aplanado?		mixture of sound and overall gestalt		Basic actions and technology	AUDITORY
1466	slap	palmada		mixture of sound and overall gestalt		Basic actions and technology	AUDITORY
1467	air escaping through water	aire escapando del agua		mixture of sound and overall gestalt		The physical world	AUDITORY
1468	biting on corn on the cob, apples, meat on the bone	morder maíz de la mazorca, manzanas, o carne del hueso		mixture of sound and overall gestalt		Food and drink	AUDITORY
1469	crunching something hard, a stick, bone	triturar/romper algo duro, un palo o hueso		mixture of sound and overall gestalt		Basic actions and technology	AUDITORY
1470	crunching small seeds	triturar semillas pequeñas		mixture of sound and overall gestalt		Basic actions and technology	AUDITORY
1471	crushing, opening platano skin with the teeth	triturar, abrir cáscara de plátano con los dientes		mixture of sound and overall gestalt		Basic actions and technology	AUDITORY
1472	crushing/mashing something fairly soft	triturar/machacar algo muy suave		mixture of sound and overall gestalt		Basic actions and technology	AUDITORY
1473	smush	aplastar/chancar		mixture of sound and overall gestalt		Basic actions and technology	AUDITORY
1474	rain or small objects falling	lluvia u objetos pequeños cayendo		mixture of sound and overall gestalt		Motion	AUDITORY
1475	rocks hitting each other	rocas golpeándose unas con otras		mixture of sound and overall gestalt		Motion	AUDITORY
1476	sand trickling	arena escurriendo		mixture of sound and overall gestalt		Motion	AUDITORY
1477	scraping metal	arañar/raspar metal		mixture of sound and overall gestalt		Basic actions and technology	AUDITORY
1478	pop balloon, rifle, testicles, oranges	reventar globo, rifle, testículos, naranjas		mixture of sound and overall gestalt		Basic actions and technology	AUDITORY
1479	splatter egg/mud	salpicar huevos/barro		mixture of sound and overall gestalt		Basic actions and technology	AUDITORY
1480	walking in mud	caminar en el barro		mixture of sound and overall gestalt		Motion	AUDITORY
1481	walking in water with boots on	caminar en el agua con las botas puestas		mixture of sound and overall gestalt		Motion	AUDITORY
1482	walking on something hard with heels	caminar sobre algo duro con tacos		mixture of sound and overall gestalt		Motion	AUDITORY
1483	grease sizzling	grasa al freírse/cocinarse		mixture of sound and overall gestalt		Food and drink	AUDITORY
1484	scratch	arañazo/rasguño		mixture of sound and overall gestalt		Basic actions and technology	AUDITORY
1485	small object skittering	objeto pequeño escabulléndose		mixture of sound and overall gestalt		Motion	VISUAL, AUDITORY
1486	something jumping around	algo dando brincos				Motion	VISUAL, AUDITORY
1487	giant firefly crashing down through the forest canopy	luciérnaga gigante bajando estrepitosamente a través de la copa de los árboles		Extraído de una narrativa.		Motion	VISUAL, AUDITORY
1488	swirl	algo dando vueltas dentro de un remolino		Extraído de una narrativa.		Motion	VISUAL
1489	slither	deslizarse		Extraído de una narrativa.		Motion	VISUAL
1490	small stick snapping	romperse un palo pequeño				Basic actions and technology	AUDITORY
1491	medium (1-3 inches in diameter) stick snapping	romperse un palo mediano (1-3 pulgadas de diámetro)				Basic actions and technology	AUDITORY
1492	large branch/bone snapping	romperse una rama grande/hueso				Basic actions and technology	AUDITORY
1493	spread as a bird spreading its wings	extender, como cuando un ave extiende las alas				Animals	VISUAL
1494	spread as spread fingers or boards in a fence	extender, como cuando se separan los dedos o las tablas de un cerco				Spatial relations	VISUAL
1495	spread unevenly as with damaged/frayed wings	extender desigualmente, como en las alas dañadas/desgastadas				Spatial relations	VISUAL
1496	swelling of a compact mass, such as a tight wad of cotton that is suddenly released, or insects swarming	hincharse una masa compacta, como una bolita compacta de algodón que es soltaba rápidamente, o insectos formando un enjambre				Spatial relations, Animals	VISUAL
1497	waving arms in the air	agitar los brazos en el aire				Basic actions and technology	VISUAL
1498	clatter to the ground	caerse estrepitosamente al suelo				Motion	AUDITORY
1499	boiling	algo hirviendo				Food and drink	AUDITORY
1500	laughter	risa				Emotion and values	AUDITORY
1501	dog barking	perro ladrando				Animals	AUDITORY
1502	threatening cry	grito amenazante				Speech and language	AUDITORY
1503	happening easily and quickly	ocurrir fácil y rápidamente				OTHER	?
1504	falling down	caer				Motion	VISUAL, AUDITORY
1505	bird croaking	ave graznando				Animals	AUDITORY
1506	desire and lust	deseo y lujuria				Emotion and values	INTERNAL STATE
1507	slowly falling down	caer lentamente				Motion	VISUAL
1508	falling down to break	caerse y romperse				Motion	AUDITORY, VISUAL
1509	tree falling down	árbol cayéndose				Agriculture and vegetation, Motion	AUDITORY
1510	sth. falling into water	algo cayéndose al agua				Motion	AUDITORY
1511	sizzling	sonido de freír algo		La última sílaba de la reduplicación tiene vocal larga.		Food and drink	AUDITORY
1512	sliding down	resbalar hacia abajo				Motion	VISUAL
1513	falling down after sliding	caerse después de resbalar				Motion	VISUAL
1514	applying magic	aplicar magia				Religion and belief	?
1515	child crying	niño/a llorando				Emotion and values	AUDITORY
1516	firing of gun	disparo de arma de fuego		"[T]he forms vary somewhat from speaker to speaker"". There does not seem to be consistency in reproducing the sounds suggested by a particular event or thing"		Warfare and hunting	AUDITORY
1517	thumping	golpear				Basic actions and technology	AUDITORY
1518	howling	aullar				Animals	AUDITORY
1519	banging	tocar/golpear (p. ej., una puerta)				Basic actions and technology	AUDITORY
1520	pulling off	jalar				Basic actions and technology	VISUAL
1521	laughing	reír				Emotion and values	AUDITORY
1522	splitting open	abrir algo partiéndolo				Basic actions and technology	AUDITORY, VISUAL
1523	clap	aplaudir				Basic actions and technology	AUDITORY
1524	drip	goteo				The physical world	AUDITORY
1525	tight	apretado				Sense perception	TACTILE
1526	crow	cacarear				Animals	AUDITORY
1527	die	morir				The body	INTERNAL STATE
1528	drag	arrastrar				Motion	VISUAL, AUDITORY
1529	rock (side to side)	mecer de un lado a otro				Motion	VISUAL
1530	to come out into clearing	salir a un lugar despejado				Motion	VISUAL
1531	slip loose	¿soltarse/desprenderse?				Basic actions and technology	VISUAL
1532	lie on ground	yacer en el suelo				Spatial relations	VISUAL
1533	to go in a line	ir en fila				Spatial relations	VISUAL
1534	up	hacia arriba		"Se repite en el ejemplo: ""say, say, say, say [...]""."		Motion	VISUAL
1535	become light	iluminarse				The physical world	VISUAL
1536	become dark	oscurecerse				The physical world	VISUAL
1537	set down	¿bajar algo/colocar algo abajo?				Motion	VISUAL
1538	flash	destello				Sense perception	VISUAL
1539	slip	resbalarse				Basic actions and technology	VISUAL
1540	splash	¡splash! / caer en el agua / salpicar?				Motion	AUDITORY
1541	break (slender object)	romper (objeto delgado)				Basic actions and technology	AUDITORY
1542		voz del mono washi				Animals	AUDITORY
1543		gritos de la gallina apresada				Animals	AUDITORY
1544		voz del faisán (aunts) espantado				Animals	AUDITORY
1545		voz del jefe de los monos washi				Animals	AUDITORY
1546		voz del ave sunka, del sapo shanká y de la culebra wánip				Animals	AUDITORY
1547		quejidos, sollozos				Emotion and values	AUDITORY
1548		voz del ave seuk				Animals	AUDITORY
1549		voz del ave iísip’				Animals	AUDITORY
1550		voz de la lemucha (káshai) y de la capibara (unkúmia)				Animals	AUDITORY
1551		voz de la lagartija náitiaksumpa				Animals	AUDITORY
1552		voz del ave tayu				Animals	AUDITORY
1553		chillido del perro				Animals	AUDITORY
1554		estornudo (de las personas)				The body	AUDITORY
1555		ladrido		La última vocal de la reduplicación se alarga.		Animals	AUDITORY
1556		pum, de golpe				Basic actions and technology	AUDITORY
1557		voz del mono ujúkam				Animals	AUDITORY
1558		voz del sajino yankípik; jadeo				Animals	AUDITORY
1559		voz del mono jéekam				Animals	AUDITORY
1560		grito ritual para alejar a los malos espíritu emésak, durante la celebración de la tsantsa.				Religion and belief, Speech and language	AUDITORY
1561		jadeo				The body	AUDITORY
1562		voz del ave tseréchink’				Animals	AUDITORY
1563		voz de las aves tsánti y kintiachinki				Animals	AUDITORY
1564		voz del ave pitsa				Animals	AUDITORY
1565		voz del trompetero				Animals	AUDITORY
1566		voz de los sapos juátᵘ y tseátᵘ				Animals	AUDITORY
1567		voz del pavo kuyu y del avecilla maitiún				Animals	AUDITORY
1568		silbido de una flecha, o bala				Warfare and hunting	AUDITORY
1569		carcajada femenina				Emotion and values	AUDITORY
1570		voz de la paloma paúm				Animals	AUDITORY
1571		ruido intestinal				The body	AUDITORY
1572		rugido (del tigre)				Animals	AUDITORY
1573		sonido de la flauta				Basic actions and technology	AUDITORY
1574		gruñido (del sajino bravo)				Animals	AUDITORY
1575		gruñido (del sahino al escaparse)				Animals	AUDITORY
1576		borbolleo (del agua que hierve)				Food and drink	AUDITORY
1577		voz del ave yúkuru				Animals	AUDITORY
1578		voz del búho yawá-ampush; voz para alejar las fieras				Animals	AUDITORY
1579		voz de la tórtola yámpits				Animals	AUDITORY
1580		voz del paují (mashu)				Animals	AUDITORY
1581		voz del ave de rapiña kaúta				Animals	AUDITORY
1582		cacareo (de la gallina)				Animals	AUDITORY
1583		ruido de algo que choca contra las ramas de las plantas				Agriculture and vegetation	AUDITORY
1584		crujir (del árbol que va a caer)				Agriculture and vegetation	AUDITORY
1585		voz del ave panka				Animals	AUDITORY
1586		crujido (del árbol que cae, o sacudido por el viento)				Agriculture and vegetation	AUDITORY
1587		crujido (de las quinchas, del árbol que cae, o sacudido por el viento)				Agriculture and vegetation	AUDITORY
1588		crujido (al caerse un árbol)				Agriculture and vegetation	AUDITORY
1589		voz del sapo purusham				Animals	AUDITORY
1590		voz del sapo kaka y del ave kakárpats				Animals	AUDITORY
1591		voz del oso (bravo)				Animals	AUDITORY
1592		crac (ruido de quebrar)				Basic actions and technology	AUDITORY
1593		voz del ave kamukam				Animals	AUDITORY
1594		voz del gallo en los peligros				Animals	AUDITORY
1595		voz del sapo karákras				Animals	AUDITORY
1596		voz del ave kakárpats				Animals	AUDITORY
1597		voz del sapo takáshᵘ				Animals	AUDITORY
1598		voz del ave aúnts (faisán)				Animals	AUDITORY
1599		voz del ave kérua				Animals	AUDITORY
1600		tac (ruido de caer)				Motion	AUDITORY
1601		voz del ave káawia				Animals	AUDITORY
1602		ruido de masticar				Food and drink, The body	AUDITORY
1603		voz del ave kíruancham				Animals	AUDITORY
1604		voz del ave wikiúakiua				Animals	AUDITORY
1605		arre, vete, lárgate! (voz para alejar animales)		Parece interjección.		Animals	AUDITORY
1606		voz para alejar a los perros				Animals	AUDITORY
1607		voz para alejar las aves				Animals	AUDITORY
1608		voz para alejar las fieras				Animals	AUDITORY
1609		ruido (de huesos)				The body	AUDITORY
1610		voz del sapo suya				Animals	AUDITORY
1611		voz del sapo kiámp				Animals	AUDITORY
1612		voz del sapito kirísip’				Animals	AUDITORY
1613		voz del sapo kirúpash				Animals	AUDITORY
1614		tos				The body	AUDITORY
1615		voz del sapo puách’				Animals	AUDITORY
1616		voz del sapo kua̠				Animals	AUDITORY
1617		ruido de rajar, quebrar				Basic actions and technology	AUDITORY
1618		grito, lloro (a gritos)				Emotion and values	AUDITORY
1619		voz del ave paínkia-pinínch’				Animals	AUDITORY
1620		voz del ave kantará				Animals	AUDITORY
1621		voz del flautero				Animals	AUDITORY
1622		voz del ave yúkupu y kupi				Animals	AUDITORY
1623		ronquidos				The body	AUDITORY
1624		ronquido (al despertarse improvisamente)				The body	AUDITORY
1625		voz de la guatusa				Animals	AUDITORY
1626		ruido de escupir				The body	AUDITORY
1627		voz del amich’ y del trompetero chiwia al ser alcanzados				Animals	AUDITORY
1628		ruido de talar				Agriculture and vegetation	AUDITORY
1629		con un golpe, de improviso				Basic actions and technology	VISUAL, AUDITORY
1630		voz del ave kute				Animals	AUDITORY
1631		voz del gato; berrido				Animals	AUDITORY
1632		voz para llamar el gato		Parece interjección		Animals	AUDITORY
1633		ruido de la boca al comer				Food and drink, The body	AUDITORY
1634		voz del ave shiík				Animals	AUDITORY
1635		voz del sapo muruímias				Animals	AUDITORY
1636		voz del sapo tentémpᵘ				Animals	AUDITORY
1637		gruñidos, ruido de morder huesos				Speech and language, Basic actions and technology	AUDITORY
1638		canto del gallo montés ayáchui				Animals	AUDITORY
1639		golpe				Basic actions and technology	AUDITORY
1640		ruido de un golpe				Basic actions and technology	AUDITORY
1641		voz del sapo paí; listo listo!				Animals	AUDITORY
1642		pum, golpe, de golpe, a golpes				Basic actions and technology	AUDITORY
1643		hacer palmas, golpear las manos				Basic actions and technology	AUDITORY
1644		poner uno encima de otro, sobreponer algo				Spatial relations	VISUAL
1645		brincar, saltar encima (de una rama a otra), chocar (sobre las ramas y las hojas)				Motion	VISUAL, AUDITORY
1646		golpe suave				Basic actions and technology	AUDITORY
1647		voz del ave wakán’				Animals	AUDITORY
1648		voz del pájaro carpintero tatásham				Animals	AUDITORY
1649		voz del tapir				Animals	AUDITORY
1650		voz del ave pirísit				Animals	AUDITORY
1651		golpe suave (del hacha, del machete y de las teclas de una máquina de escribir)				Basic actions and technology	AUDITORY
1652		muchos golpes seguidos				Basic actions and technology	AUDITORY
1653		voz del ave úshap				Animals	AUDITORY
1654		voz del mono tséepai				Animals	AUDITORY
1655		voz del ave piwi				Animals	AUDITORY
1656		voz del ave puúr y del sapo puínt; canción de cuna				Animals	AUDITORY
1657		voz del ave tushim				Animals	AUDITORY
1658		ruido de rajarse, romperse en pedazos (hierros, vasijas…)				Basic actions and technology	AUDITORY
1659		ruido (fuertes golpes; truenos)				Sense perception	AUDITORY
1660		ruido fuerte de un trueno que va alejándose				The physical world	AUDITORY
1661		borboteo (de una vertiente)				The physical world	AUDITORY
1662		ruido de clavar (en el suelo)				Basic actions and technology	AUDITORY
1663		ruído de zampullir				Motion	AUDITORY
1664		voz del mono yakum (mono coto)				Animals	AUDITORY
1665		ruido (de raspar, arrancar, morder, carcomer)				Basic actions and technology	AUDITORY
1666		ruido de arrancar				Basic actions and technology	AUDITORY
1667		voz de los loros kawá, achu kawá y shámak				Animals	AUDITORY
1668		ruido de rozar con algo				Basic actions and technology	AUDITORY
1669		ruido (de arrancarse, o soltarse)				Basic actions and technology	AUDITORY
1670		voz de los pichones buglas hambrientos				Animals	AUDITORY
1671		sonido al sacudir el hisopo sasankᵘ; al deslizarse en el agua				Basic actions and technology	AUDITORY
1672		zumbido (de los enjambres de avispas, o del batir de alas)				Animals	AUDITORY
1673		voz del ave nunkankit y de la culebra secha-napi				Animals	AUDITORY
1674		voz del azulejo secha				Animals	AUDITORY
1675		voz del ave tsanke (bugla)				Animals	AUDITORY
1676		ruido (de motores)				Basic actions and technology	AUDITORY
1677		voz del buho úunt-ampush				Animals	AUDITORY
1678		ronquido, soplo, respiro afanoso				The body	AUDITORY
1679		voz del mono sunkamat				Animals	AUDITORY
1680		voz del ave sunkarkut (bugla)				Animals	AUDITORY
1681		aleteo				Animals	VISUAL, AUDITORY
1682		voz del oso hormiguero wishíwshi				Animals	AUDITORY
1683		soplo				Basic actions and technology	AUDITORY
1684		llanto del bebé; voz del cuervo shanáshnia				Emotion and values	AUDITORY
1685		voz del loro shámak				Animals	AUDITORY
1686		ruido de un chaparrón, del aguacero				The physical world	AUDITORY
1687		ruido (de algo que cae)				Motion	AUDITORY
1688		ruido (de meter, de rozar)				Motion	AUDITORY
1689		llorar del pollo, voz del loro shiápᵘ				Animals	AUDITORY
1690		voz del grillo chúnchup’				Animals	AUDITORY
1691		voz del grillo tinkishap’				Animals	AUDITORY
1692		voz del periquito nuínuí				Animals	AUDITORY
1693		grito (para llamar al perro lejano)		Parece interjección.		Animals	AUDITORY
1694		silbido				Basic actions and technology	AUDITORY
1695		voz del ave acuática piámpia y de la golondrina shuírpip				Animals	AUDITORY
1696		voz de la perdiz waa				Animals	AUDITORY
1697		derrame				The physical world	AUDITORY
1698		ruido de engullir				Food and drink, The body	AUDITORY
1699		voz del tapir y del caballo				Animals	AUDITORY
1700		voz del mono tsere (jáanchᵘ)				Animals	AUDITORY
1701		voz de la perdiz wankesh				Animals	AUDITORY
1702		sonido de asentar				Motion	VISUAL, AUDITORY
1703		gritos del mono washi				Animals	AUDITORY
1704		voz de la lora pushúkawá				Animals	AUDITORY
1705		voz de los pollitos al traerles la comida				Animals	AUDITORY
1706		ruido de algo que cae en el lodo				Motion	AUDITORY
1707		golpe (de choque)				Basic actions and technology	AUDITORY
1708		voz del ave chanke				Animals	AUDITORY
1709		bulla, alboroto				Speech and language	AUDITORY
1710		voz del ave charakat (martín pescador)				Animals	AUDITORY
1711		voz del mono chuu				Animals	AUDITORY
1712		voz del ave chaasem				Animals	AUDITORY
1713		voz de buen agüero del ave ikiánchim				Animals	AUDITORY
1714		voz del mono washi asustado				Animals	AUDITORY
1715		voz del mirlo yúkupu				Animals	AUDITORY
1716		voz del ave chiankái				Animals	AUDITORY
1717		llanto, quejido, chillido				Emotion and values	AUDITORY
1718		acción de abrir la boca				The body	AUDITORY
1719		silbido (del oído, de la leña verde en el fuego, de algo caliente al contacto con algo frío); voz del grillo tíinchup’				Sense perception	AUDITORY
1720		voz de mal agüero del ave ikiánchim				Animals	AUDITORY
1721		voz del zorro míkiua (voz de mal agüero)				Animals	AUDITORY
1722		crac (ruido al destacarse, o al desgajarse, una rama, o un miembro del cuerpo)				Sense perception	AUDITORY
1723		bulla (lloro)				Emotion and values	AUDITORY
1724		llanto del bebé				Emotion and values	AUDITORY
1725		voz del perico chiimp				Animals	AUDITORY
1726		voz del sapito chirímius				Animals	AUDITORY
1727		voz del avecilla kapantin-chinki				Animals	AUDITORY
1728		voz del ave chuwi (bugla)				Animals	AUDITORY
