ID	ENGLISH	SPANISH	PORTUGUESE	NOTES	SIMPLIFIED	SEMANTIC FIELD	SENSORY CATEGORY
513		hacer burbujear, sonar al burbujear en el agua				The physical world	AUDITORY
514		sonido de hundimiento en el agua, de burbujeo				The physical world	AUDITORY
515		sonido al caminar				Motion	AUDITORY, VISUAL
516		sonido del corte que se asienta				Basic actions and technology	AUDITORY
517		sonido de corte				Basic actions and technology	AUDITORY
518		trac, trac, sonido que se produce al cortar				Basic actions and technology	AUDITORY
519		"sonido ""pon"" al caer"				Motion	AUDITORY, VISUAL
520		sonido de patada				Basic actions and technology	AUDITORY
521		sonido al arrojar algo				Motion	AUDITORY, VISUAL
522		ruido motor				Basic actions and technology	AUDITORY
523		sonido de un golpe, por ejemplo al cortar palos de leña				Basic actions and technology	AUDITORY
524		shaaa, sonido al derramar cualquier cosa seca como harinas o varios granos en un envase, movimiento de las ramas				Motion	AUDITORY, VISUAL
525		sonido al escurrir la flema				The body	AUDITORY
526		sonido de jalar fibras, resbalar algo				Motion	VISUAL, AUDITORY
527		sonido que se produce cuando una persona cae al agua				Motion	AUDITORY, VISUAL
528		sonido de la corriente de agua y del viento				The physical world	AUDITORY
529		sonido de nadar/bañarse		Transcripción: [tsoopo]		Motion	AUDITORY
530	swish	silbido (sonido sibilante)				Sense perception	AUDITORY
531	denotes a very small fish swarming in large numbers	denota un pez muy pequeño en su cardumen				Animals	VISUAL
532	the flash of the flying arrow	el destellar de una flecha en movimiento				Warfare and hunting	VISUAL
533	twig cracking noise	ruido de ramas crujiendo				Agriculture and vegetation	AUDITORY
534	voice of the jaguar	sonido del jaguar				Animals	AUDITORY
535	departing	marcharse				Motion	VISUAL
536	licking with tongue	lamer con la lengua				The body	GUSTATORY
537	flaming of fire	fuego llameando				The physical world	VISUAL
538	water smashing against boat in rapids	agua chocando contra el bote en los rápidos				The physical world	AUDITORY
539	climbing	trepar				Motion	VISUAL
540	hitting with blunt instrument	golpear con instrumento contundente				Basic actions and technology	AUDITORY
541	kicking, hitting something solid (like canoe hitting rock, arrow hitting target)	patear, golpear algo sólido (como la canoa que golpea una roca, la flecha que da en el objetivo)				Basic actions and technology	AUDITORY
542	cessation of action or talk, silence, stopping to look around	dejar de hacer o hablar, silencio, detenerse a mirar				Motion	AUDITORY, VISUAL
543	collapsing	calapsar				Basic actions and technology	VISUAL
544	touching	tocar				Sense perception	TACTILE
545	sitting down	sentarse				Basic actions and technology	VISUAL
546	approaching	acercarse				Motion	VISUAL
547	coming out, emerging into the open	salir				Motion	VISUAL
548	splitting wood	partir madera				Basic actions and technology	AUDITORY
549	being hurled through the air	ser lanzado por el aire				Motion	VISUAL
550	breaking (of tooth, bone, etc.)	romperse (un diente, un hueso, etc.)				Basic actions and technology	AUDITORY
551	passing through a narrow passage (e.g. trail in forest)	pasar por un pasaje estrecho (p. e.j., un camino en el bosque)				Motion	VISUAL
552	sucking by shaman in healing rite	succión del chamán en un rito de curación				Religion and belief	AUDITORY
553	paddling	remar				Basic actions and technology	VISUAL, AUDITORY
554	blowing, breathing out heavily	soplar, exhalar con fuerza				The body	AUDITORY
555	buzzing of flies	zumbido de moscas		El último elemento de la reduplicación aparece sin consonante final.		Animals	AUDITORY
556	shooting (shotgun)	disparar (arma de fuego)				Warfare and hunting	AUDITORY
557	giving birth, i.e. child emerging from womb	dar a luz, es decir, emerger el bebé del útero				The body	VISUAL
558	bubbling of water (in river or when boiling)	burbujeo del agua (del río o al hervirse)		El último elemento de la reduplicación aparece sin consonante final.		The physical world	AUDITORY
559	blowing tobaco smoke	soplar humo del tabaco				Basic actions and technology	AUDITORY
560	whirring of wings of the hummingbird	zumbido de alas del colibrí		"""p"" is a trilled bilabial plosive"		Animals	VISUAL, AUDITORY
561	fast movement, as when chasing someone	movimiento rápido, como cuando se persigue a alguien		"""p"" is a trilled bilabial plosive"		Motion	VISUAL
562	rising up, climbing out of boat	subir, salirse de un bote				Motion	VISUAL
563	stepping, walking, running	pisar, caminar, correr		El último elemento de la reduplicación aparece sin consonante final.		Motion	VISUAL, AUDITORY
564	sharpening (knife or stone), planing	afilar (cuchillo o piedra), cepillar madera				Basic actions and technology	VISUAL, AUDITORY
565	washing (clothes or body)	lavar (la ropa o el cuerpo)				Clothing and grooming	AUDITORY, VISUAL
566	dragging, sliding	arrastrar, deslizarse				Motion	VISUAL, AUDITORY
567	pulling in fishing line	jalar el hilo de pescar				Basic actions and technology	VISUAL
568	buring a hole in	hacer/performar un agujero en				Basic actions and technology	VISUAL, AUDITORY
569	burning	quemar/arder				Basic actions and technology	VISUAL
570	cutting up flesh	cortar carne				Basic actions and technology	AUDITORY
571	swimming	nadar		El último elemento de la reduplicación aparece sin consonante final.		Motion	AUDITORY, VISUAL
572	pulling out (e.g. a stick from the ground)	sacar jalando (p. ej., un palo del suelo)				Motion	VISUAL
573	shaking loose	quitar algo a sacudidas		El último elemento de la reduplicación aparece sin consonante final.		Basic actions and technology	VISUAL
574	pushing	empujar				Motion	VISUAL
575	laying down	echarse				Basic actions and technology	VISUAL
576	cracking open (e.g. Brazil nuts)	abrir rompiendo (p. ej., nueces de Brasil)				Basic actions and technology	AUDITORY, VISUAL
577	grasping hold of	agarrar				Basic actions and technology	VISUAL
578	standing, reaching up	estar de pie, alcanzar				Basic actions and technology	VISUAL
579	tottering steps	pasos vacilantes				Motion	VISUAL
580	spitting	escupir				The body	AUDITORY
581	cutting (with scissors, knife, etc.)	cortar (con tijeras, cuchillo, etc.)				Basic actions and technology	AUDITORY
582	canoe pulling in to river bank	jalar la canoa a la orilla del rio				Basic actions and technology	VISUAL
583	picking fruit from tree	sacar fruta de un árbol				Agriculture and vegetation, Food and drink	VISUAL, AUDITORY
584	piercing	perforar				Basic actions and technology	VISUAL, AUDITORY
585	hitting and killing (an animal) with a club or the like	golpear y matar (a un animal) con un palo o algo parecido				Warfare and hunting	AUDITORY, VISUAL
586	shaking the head	sacudir la cabeza de lado a lado				The body, Motion	VISUAL
587	falling and collapsing on the ground, eather seated or prostrate	caer y colapsar en el piso, sentado o postrado		Secuencia de ideófonos		Motion	VISUAL
588	falling and going full length (e.g. a tree, or a person tripping on the trail)	caer y quedar horizontal (p. ej., un árbol, o una persona que se tropieza en el camino)		Secuencia de ideófonos		Motion	VISUAL
589	falling and hitting the ground (something thrown)	caer y golpear el piso (algo que es lanzado)		Secuencia de ideófonos		Motion	VISUAL, AUDITORY
590	climbing, then descending	trepar y después bajar		Secuencia de ideófonos		Motion	VISUAL
591	grasping hold of something and taking it away	agarrar algo y llevárselo		Secuencia de ideófonos		Basic actions and technology	VISUAL
592	grasping hold of something and dragging it away	agarrar algo y llevárselo arrastrando		Secuencia de ideófonos		Basic actions and technology	VISUAL, AUDITORY
593	embracing and kissing	abrazar y besar		Secuencia de ideófonos		Basic actions and technology	VISUAL, AUDITORY
594	reaching up and picking fruit from tree	alcanzar y sacar una fruta de un árbol		Secuencia de ideófonos. El último elemento de la reduplicación aparece sin consonante final.		Agriculture and vegetation, Food and drink	VISUAL, AUDITORY
595	(palm tree) falling to ground, pushing and picking it up, then throwing it	(palmera) cayendo al piso, empujándola y levantándola, y luego lanzándola		Secuencia de ideófonos		Motion	VISUAL, AUDITORY
596	with no breath	sin aliento		Semantic field: Actions/Movements		The body	?
597	pulling off a leaf	arrancar una hoja		Semantic field: Actions/Movements		Agriculture and vegetation	VISUAL, AUDITORY
598	hit suddenly (in just one blow)	golpear de repente		Semantic field: Actions/Movements		Basic actions and technology	AUDITORY
599	spitting	escupir		Semantic field: Actions/Movements		The body	AUDITORY
600	animal or human pack running	grupo de animales o personas corriendo		Semantic field: Actions/Movements		Motion, Quantity	VISUAL, AUDITORY
601	moving without stopping in a reduced area	moverse sin detenerse en una área reducida		Semantic field: Actions/Movements		Motion	VISUAL
602	sound of applauding or breaking (ceramics, hard-shell fruits, etc.)	sonido de aplaudir o romper (cerámicas, frutos de cáscara dura, etc.)		Semantic field: Actions/Movements		Basic actions and technology	AUDITORY
603	throwing a stone or a small projectile quickly, jump	lanzar una piedra o algo pequeño rápidamente, saltar		Semantic field: Actions/Movements		Motion	VISUAL
604	making somenthing disappear quickly	hacer que algo desaparezca rápidamente		Semantic field: Actions/Movements		Basic actions and technology	?
605	cutting with machete	cortar con machete		Semantic field: Actions/Movements		Basic actions and technology	AUDITORY
606	grabbing forcefully or suddenly	agarrar con fuerza o súbitamente		Semantic field: Actions/Movements		Basic actions and technology	VISUAL
607	tearing a piece of cloth	desgarrar una tela		Semantic field: Actions/Movements		Basic actions and technology	AUDITORY
608	driving something (e.g. a spear) into the soil	meter algo (p. ej., una lanza) en el suelo		Semantic field: Actions/Movements		Basic actions and technology	VISUAL, AUDITORY
609	pulling off a palm leaf	arrancar una hoja de palmera		Semantic field: Actions/Movements		Agriculture and vegetation	AUDITORY
610	swimming (also applies to fish and other animals like river otter, capibara, etc.)	nadar (también se aplica a peces y otros animales como nutria, capibara, etc.)		Semantic field: Actions/Movements		Motion	VISUAL, AUDITORY
611	shinning, blazzing	brillar, resplandecer		Semantic field: Sensorial (not including sound)		Sense perception	VISUAL
612	smell of blood	olor a sangre		Semantic field: Sensorial (not including sound)		Sense perception	OLFACTORY
613	soft	suave		Semantic field: Sensorial (not including sound)		Sense perception	TACTILE
614	pain in some body part or bone	dolor en una parte del cuerpo o hueso		Semantic field: Sensorial (not including sound)		The body	INTERNAL STATE
615	sneezing	estornudar		Semantic field: Human or body sounds		The body	AUDITORY
616	farting	tirarse un pedo		Semantic field: Human or body sounds		The body	AUDITORY
617	noise of women or children talking	ruido de mujeres o niños hablando		Semantic field: Human or body sounds		Speech and language	AUDITORY
618	noise of adult man yelling	ruido de hombres gritando		Semantic field: Human or body sounds		Speech and language	AUDITORY
619	noise of adult men talking	ruido de hombre hablando		Semantic field: Human or body sounds		Speech and language	AUDITORY
620	butterfles flying	mariposas volando		Semantic field: Animal and nature actions		Animals	VISUAL
621	sound of peccaries eating	sonido de pecaríes comiendo		Semantic field: Animal and nature actions		Animals	AUDITORY
622	sound of river waves	sonido de olas del río		Semantic field: Animal and nature actions		The physical world	AUDITORY
623	sound of snake slithering	sonido de serpiente deslizándose		Semantic field: Animal and nature actions		Animals	VISUAL, AUDITORY
624	rocks falling from a cliff	rocas cayendo de un acantilado		Semantic field: Animal and nature actions		The physical world	VISUAL, AUDITORY
625	sound/breeze preceding a rain	sonido/brisa que precede a la lluvia		Semantic field: Animal and nature actions		The physical world	AUDITORY
626	buzzing (bee, wasp, hummingbird)	zumbido (abeja, avispa, colibrí)		Semantic field: Animal and nature actions		Animals	AUDITORY
627	solid object colliding with another solid object	objeto sólido chocando con otro objeto sólido		Semantic field: Sounds of objects being manipulated, breaking, colliding		Basic actions and technology	VISUAL, AUDITORY
628	object falling into the fire	objeto cayendo en el fuego		Semantic field: Sounds of objects being manipulated, breaking, colliding		Motion	VISUAL, AUDITORY
629	sound of water dripping, rocks, snails or rattle being moved,						
630	also sound of muzzle-loader rifle	sonido de agua derramándose; mover rocas, caracoles o sonajas; sonido de rifle de avancarga		Semantic field: Sounds of objects being manipulated, breaking, colliding		Basic actions and technology	AUDITORY, VISUAL
631	different objects crashing on each other	diferentes objetos chocando unos con otros		Semantic field: Sounds of objects being manipulated, breaking, colliding		Basic actions and technology	VISUAL, AUDITORY
632	sound of palm leaves being pulled out	sonido de hojas de palma siendo arrancadas		Semantic field: Sounds of objects being manipulated, breaking, colliding		Agriculture and vegetation	AUDITORY
633	poking the fire	atizar el fuego		Semantic field: Sounds of objects being manipulated, breaking, colliding		Basic actions and technology	VISUAL
634	dog howling	aullido de perro		Semantic field: Animal voices		Animals	AUDITORY
635	dog barking	ladrido de perro		Semantic field: Animal voices		Animals	AUDITORY
636	jaguar’s voice (growling)	sonido de jaguar (gruñido)		Semantic field: Animal voices		Animals	AUDITORY
637	jaguar roaring	rugido de jaguar		Semantic field: Animal voices		Animals	AUDITORY
638	tapir’s voice	sonido del tapir		Semantic field: Animal voices		Animals	AUDITORY
639	curasow’s calling	canto del paujil (especie de ave)		Semantic field: Animal voices		Animals	AUDITORY
640	hoatzin’s calling	canto del shansho (especie de ave)		Semantic field: Animal voices		Animals	AUDITORY
641	rooster crowing	cacareo de gallo		Semantic field: Animal voices		Animals	AUDITORY
642	sound associated with traveling or going somewhere	sonido asociado con viajar o ir a algún lugar				Motion	VISUAL
643	movement upwards or upstream	movimiento hacia arriba o río arriba				Motion	VISUAL
644	jumping o landing somewhere suddenly, an object hitting something	saltar o aterrizar en algún lugar súbitamente, un objeto golpeándose contra algo				Motion	VISUAL, AUDITORY
645	giggling	reírse en voz baja				Emotion and values	AUDITORY
646	laughing loudly	reírse en voz alta				Emotion and values	AUDITORY
647	snoring	roncar				The body	AUDITORY
648	calling out to another person	llamar a otra persona				Speech and language	AUDITORY
649	noise of falling into water	sonido al caer al agua				Motion	AUDITORY
650	sound of killing fish by braking their necks	sonido de matar a un pez rompiéndole el cuello				Warfare and hunting, Animals	AUDITORY
651	large bird landing	ave grande aterrizando				Animals	AUDITORY, VISUAL
652	noise of a machete hitting or cutting something	sonido del machete al golpear o cortar algo				Basic actions and technology	AUDITORY
653	the bones of a turtle-anklebone oracle knocking against each other	los huesos de un oráculo de tobillo de tortuga chocando entre sí				Basic actions and technology	AUDITORY, VISUAL
654	an object hitting against someone	un objeto golpeando a alguien				Basic actions and technology	AUDITORY, VISUAL
655	flipping through air	aleteando en el aire		"Descrito como ""marginally conventionalized sound effect"""		Animals	VISUAL
656	hitting	golpear		"Descrito como ""marginally conventionalized sound effect"""		Basic actions and technology	VISUAL, AUDITORY
657	hawk falling	ave cayendo		"Descrito como ""marginally conventionalized sound effect"""		Animals	VISUAL
658	thunder rumbling	trueno retumbando				The physical world	AUDITORY
659	a bird flying away	un ave que se va volando				Animals	VISUAL
660	the eating noise/action of a fish	el sonido o la acción de comer del pez				Food and drink	VISUAL, AUDITORY
661	running	correr				Motion	VISUAL, AUDITORY
662	rummaging through things while searching	hurgar entre las cosas al buscar algo				Basic actions and technology	VISUAL, AUDITORY
663	a spirit falling out of tree	un espíritu cayéndose de un árbol		relatively non-conventionalized ideophone-like sound effect used in a narrative, probably chosen ad hoc by the storyteller		Religion and belief, Motion	?
664	a severed head falling to the ground	una cabeza decapitada cayendo al suelo		relatively non-conventionalized ideophone-like sound effect used in a narrative, probably chosen ad hoc by the storyteller		Motion	VISUAL, AUDITORY
665	a woodpecker pecking	un pájaro carpintero picoteando		relatively non-conventionalized ideophone-like sound effect used in a narrative, probably chosen ad hoc by the storyteller		Animals	AUDITORY
666	jumping and landing noises	sonidos de saltar y aterrizar		relatively non-conventionalized ideophone-like sound effect used in a narrative, probably chosen ad hoc by the storyteller		Motion	AUDITORY
667	banging noises made by the mythical tapir's attempts to beat off the turtle who had bitten on to his testicles	sonidos de golpes (hechos por un tapir mítico)		relatively non-conventionalized ideophone-like sound effect used in a narrative, probably chosen ad hoc by the storyteller		Religion and belief, Animals	AUDITORY
668	sound/action of getting or grabbing something	sonido o acción de agarrar algo		relatively non-conventionalized ideophone-like sound effect used in a narrative, probably chosen ad hoc by the storyteller		Basic actions and technology	VISUAL, AUDITORY
669	sneeze	estornudar				The body	AUDITORY
670	dove's call	sonido de la paloma				Animals	AUDITORY
671	sound of coughing	sonido de toser				The body	AUDITORY
672	sound of dog howling	sonido de perro aullando				Animals	AUDITORY
673	sound of chicken clucking	sonido de pollo cacareando				Animals	AUDITORY
674	sound of birds, especially at dawn	sonido de aves, especialmente al atardecer				Animals	AUDITORY
675	sound of gunea pig or mouse	sonido del cuy o ratón				Animals	AUDITORY
676	sound of owl	sonido del búho				Animals	AUDITORY
677	sound made by chicken flying	sonido hecho por el pollo al volar				Animals	AUDITORY
678	sound of slaps	sonido de bofetadas/palmadas				Basic actions and technology	AUDITORY
679	sound of child or small animal (e.g., a mouse) moving	sonido de un niño o animal pequeño (p. ej., un ratón) moviéndose				Motion	VISUAL, AUDITORY
680	sound of dog barking	sonido de perro ladrando				Animals	AUDITORY
681	sound of dog growling	sonido de perro gruñendo				Animals	AUDITORY
682	sound of cat purring	sonido de gato ronroneando				Animals	AUDITORY
683	sound of baby crying	sonido de bebé llorando				Emotion and values	AUDITORY
684	sarcastic laugh of woman	risa sarcástica de mujer				Emotion and values	AUDITORY
685	sound of horse neighing	sonido de caballo relinchando				Animals	AUDITORY
686	sound made by rapidly drinking a large quantity of liquid	sonido hecho al beber rápidamente una gran cantidad de líquido				Food and drink	AUDITORY
687	sound of liquid boiling	sonido de líquido hirviendo				Food and drink	AUDITORY
688	sounf of cleaning plates	sonido al limpiar platos				Basic actions and technology	AUDITORY, VISUAL
689	sound made by hen laying egg	sonido hecho por una gallina al poner un huevo				Animals	AUDITORY
690	sound of chicken when upset	sonido de un pollo cuando está molesto				Animals	AUDITORY
691	sound of rooster	sonido del gallo				Animals	AUDITORY
692	sound of squealing door or furniture	sonido de puerta o mueble chirriando				The house	AUDITORY
693	sound of guinea pig	sonido del cuy				Animals	AUDITORY
694	sound of thunder	sonido del trueno				The physical world	AUDITORY
695	sound of running	sonido de correr				Motion	AUDITORY, VISUAL
696	sound of running fast	sonido al correr rápido				Motion	AUDITORY, VISUAL
697	sound of frog	sonido de la rana				Animals	AUDITORY
698	sounfd of sheep	sonido de la oveja				Animals	AUDITORY
699	spund of cat complaining	sonido de un gato quejándose				Animals	AUDITORY
700	sound of goat	sonido de la cabra				Animals	AUDITORY
701	sound of cow	sonido de la vaca				Animals	AUDITORY
702	sound of eating toasted corn or any hard food	sonido de comer maíz tostado o cualquier alimento duro				Food and drink	AUDITORY
703	sound of (accidentally) stepping on potato or other similar object	sonido de pisar (accidentalmente) una papa o un objeto parecido				Basic actions and technology	AUDITORY, VISUAL
704	sound of walking intetionally produced by a person	sonido de caminar producido intencionalmente por una persona				Motion	AUDITORY, VISUAL
705	sound of fast walking by a person or animal	sonido de caminar rápido (hecho por una persona o animal)				Motion	AUDITORY, VISUAL
706	sound of walking on wet ground	sonido de caminar por suelo mojado				Motion	AUDITORY, VISUAL
707	sound produced by walking through a planted field and rubbing against the plants; sound of change rattling in one's pocket	sonido producido al caminar por un campo plantado y rozar con las plantas; sonido del sencillo tintineando en el bolsillo				Motion	AUDITORY
708	sound of liquid splashing; sound of rain or of snow	sonido al salpicar agua; sonido de la lluvia o de nieve				The physical world	AUDITORY
709	sound made by dried corn grains dropped from hand	sonido hecho al dejar caer/soltar granos de maíz secos				Motion	AUDITORY
710	sound of fireworks, rockets	sonido de fuegos artificiales o cohetes		pronounced rapidly		Basic actions and technology	AUDITORY
711	sound of chopping firewood	sonido de cortar leña		long pause between repetitions		Basic actions and technology	AUDITORY
712	sound of (large) bell	sonido de una campana (grande)				Basic actions and technology	AUDITORY
713	sound of door or furniture creaking	sonido de puerta o mueble chirriando				The house	AUDITORY
714	sound of blows delivered by strong men fighting	sonido de golpes dados por hombres fuertes luchando				Warfare and hunting	AUDITORY
715	sound of small bells or metal objects hitting each other	sonidos de campanas pequeñas o de objetos metálicos golpeándose unos con otros				Basic actions and technology	AUDITORY
716	sound of toasted corn toasting	sonido del maíz tostándose				Food and drink	AUDITORY
717	sound of pig	sonido del cerdo				Animals	AUDITORY
718	sound made by guinea pig when prognosticating illnes	sonido hecho por el cuy cuando pronostica enfermedades				Animals	AUDITORY
719	sound of rain, snow or of waterfall	sonido de la lluvia, nieve o cascada				The physical world	AUDITORY
720	swinging movement of something carried (e.g., one's arm or a baby's head)	movimiento oscilante de algo que uno carga o uno lleva (p. ej., el brazo de uno, o la cabeza de un bebé)				Motion	VISUAL
721	sound of crying (person or animal)	sonido de persona o animal llorando				Emotion and values	AUDITORY
722	sound of the wind	sonido del viento		Transcripción: [wɪʃ:]		The physical world	AUDITORY
723	sound of guitar played badly	sonido de una guitarra mal tocada				Basic actions and technology	AUDITORY
724	sound of mouse	sonido del ratón				Animals	AUDITORY
725	sound heard in your own ear wich means someone is thinking of you	sonido que se escucha en tu propio oído y que significa alguien esta pensando en ti				The body	INTERNAL STATE, AUDITORY
726		empujar leña	empurrar lenha			Basic actions and technology	VISUAL
727		relaciones sexuales	intercurso sexual			The body	VISUAL
728		sonido de llegada de avión	som de chegada de avião			Basic actions and technology	AUDITORY
729		sonido de pájaro	som de pássaro			Animals	AUDITORY
730		salir del lugar	sair do lugar			Motion	VISUAL
731		sonido de personas hablando	som de pessoas falando			Speech and language	AUDITORY
732		comer sopa	comer sopa			Food and drink	VISUAL, AUDITORY
733		caer/entrar/meterse al agua	bater n'água			Motion	VISUAL, AUDITORY
734		beber	bebendo			Food and drink	AUDITORY
735		raspar	raspar			Basic actions and technology	AUDITORY
736		sonido de respiración	som de respiração			The body	AUDITORY
737		reír	rir			Emotion and values	AUDITORY
738		esperar	esperar			OTHER	?
739		sonido de fuego	som de fogo			The physical world	AUDITORY
740		sonido de mono capuchino	som do macaco-prego			Animals	AUDITORY
741		sonido para llamar a inambú (especie de ave)	som para chamar inambu			Animals	AUDITORY
742		sonido de un pájaro cantando, correr	som de um pássaro cantando, correndo			Animals	AUDITORY
743		salir, dejar	sair, deixar			Motion	VISUAL
744		sonido de trompetero (tipo de ave)	som do jacamim			Animals	AUDITORY
745		viajar, correr	viajar, correr			Motion	VISUAL
746		gritar	gritar			Speech and language	AUDITORY
747		gritar	gritando			Speech and language	AUDITORY
748		"sonido de pájaro ""kyhỹn"""	som do pássaro kyhỹn			Animals	AUDITORY
749		rugido de jaguar	grito de onça			Animals	AUDITORY
750		flecha volando	flecha voando			Warfare and hunting	VISUAL, AUDITORY
751		pisotear	conculcar			Basic actions and technology	VISUAL, AUDITORY
752		recoger con la mano	pegar com a mão			Basic actions and technology	VISUAL
753		caminar en zigzag	andar ziguezagueando			Motion	VISUAL
754		sonido de trompetero (tipo de ave)	som do pássaro jacamim			Animals	AUDITORY
755		sonido de mono llorando/chillando	som de macaco chorando			Animals	AUDITORY
756		cortar un poco	cortar um pouco			Basic actions and technology	VISUAL, AUDITORY
757		sonido de sumergirse/zambullirse	som de mergulhar			Motion	AUDITORY
758		abrir caña seca (sacar tiras para tejer)	abrir palha			Agriculture and vegetation	VISUAL, AUDITORY
